{
  "$schema": "./packages/tooling/schemas/starter-release.schema.json",
  "schemaVersion": 2,
  "release": "1.0.0-dev.1",
  "status": "prerelease",
  "releasedAt": null,
  "runtime": {
    "node": "24.20.0",
    "pnpm": "11.22.0"
  },
  "approvedMajors": {
    "@biomejs/biome": 2,
    "@base-ui/react": 1,
    "@better-auth/passkey": 1,
    "@better-auth/expo": 1,
    "@aws-sdk/client-s3": 3,
    "@aws-sdk/s3-presigned-post": 3,
    "@aws-sdk/s3-request-presigner": 3,
    "@axe-core/playwright": 4,
    "@fastify/swagger": 9,
    "@fastify/swagger-ui": 6,
    "@hey-api/openapi-ts": 0,
    "@opentelemetry/api": 1,
    "@opentelemetry/exporter-metrics-otlp-http": 0,
    "@opentelemetry/exporter-trace-otlp-http": 0,
    "@opentelemetry/resources": 2,
    "@opentelemetry/sdk-metrics": 2,
    "@opentelemetry/sdk-node": 0,
    "@playwright/test": 1,
    "@tailwindcss/postcss": 4,
    "@tanstack/react-form": 1,
    "@tanstack/react-query": 5,
    "@trpc/client": 11,
    "@trpc/server": 11,
    "@types/node": 24,
    "@types/react": 19,
    "@types/react-dom": 19,
    "@vitest/coverage-v8": 4,
    "ai": 7,
    "better-auth": 1,
    "drizzle-orm": 0,
    "expo": 57,
    "expo-constants": 57,
    "expo-dev-client": 57,
    "expo-linking": 57,
    "expo-network": 57,
    "expo-router": 57,
    "expo-secure-store": 57,
    "expo-status-bar": 57,
    "fastify": 5,
    "graphile-worker": 0,
    "js-yaml": 4,
    "next": 16,
    "pino": 10,
    "railway": 3,
    "postgres": 3,
    "react": 19,
    "react-native": 0,
    "react-native-safe-area-context": 5,
    "react-native-screens": 4,
    "shadcn": 4,
    "tailwindcss": 4,
    "turbo": 2,
    "tsx": 4,
    "typescript": 6,
    "vitest": 4,
    "yaml": 2,
    "zod": 4
  },
  "testedPackages": {
    "@biomejs/biome": "2.5.9",
    "@base-ui/react": "1.7.0",
    "@better-auth/passkey": "1.7.1",
    "@better-auth/expo": "1.7.4",
    "@aws-sdk/client-s3": "3.1113.0",
    "@aws-sdk/s3-presigned-post": "3.1113.0",
    "@aws-sdk/s3-request-presigner": "3.1113.0",
    "@axe-core/playwright": "4.13.0",
    "@fastify/swagger": "9.8.1",
    "@fastify/swagger-ui": "6.1.1",
    "@hey-api/openapi-ts": "0.99.0",
    "@opentelemetry/api": "1.9.1",
    "@opentelemetry/exporter-metrics-otlp-http": "0.222.0",
    "@opentelemetry/exporter-trace-otlp-http": "0.222.0",
    "@opentelemetry/resources": "2.11.0",
    "@opentelemetry/sdk-metrics": "2.11.0",
    "@opentelemetry/sdk-node": "0.222.0",
    "@playwright/test": "1.63.0",
    "@tailwindcss/postcss": "4.3.3",
    "@tanstack/react-form": "1.33.5",
    "@tanstack/react-query": "5.101.4",
    "@trpc/client": "11.18.0",
    "@trpc/server": "11.18.0",
    "@types/node": "24.13.3",
    "@types/react": "19.2.18",
    "@types/react-dom": "19.2.4",
    "@vitest/coverage-v8": "4.1.11",
    "ai": "7.0.68",
    "better-auth": "1.7.1",
    "drizzle-orm": "0.45.2",
    "expo": "57.0.22",
    "expo-constants": "57.0.18",
    "expo-dev-client": "57.0.19",
    "expo-linking": "57.0.10",
    "expo-network": "57.0.2",
    "expo-router": "57.0.21",
    "expo-secure-store": "57.0.4",
    "expo-status-bar": "57.0.1",
    "fastify": "5.12.1",
    "graphile-worker": "0.17.3",
    "js-yaml": "4.3.2",
    "next": "16.3.3",
    "pino": "10.3.1",
    "railway": "3.11.0",
    "postgres": "3.4.9",
    "react": "19.2.3",
    "react-native": "0.86.3",
    "react-native-safe-area-context": "5.7.0",
    "react-native-screens": "4.26.0",
    "shadcn": "4.18.0",
    "tailwindcss": "4.3.3",
    "turbo": "2.10.10",
    "tsx": "4.23.12",
    "typescript": "6.0.3",
    "vitest": "4.1.11",
    "yaml": "2.9.0",
    "zod": "4.4.3"
  },
  "containerImages": {
    "node": {
      "reference": "node:24.20.0-bookworm-slim",
      "digest": "sha256:ba849c60be29959425b8734d57b8b4b7d56f98edd9504c9af091d5281095a71e"
    },
    "postgresql": {
      "reference": "postgres:18.3-bookworm",
      "digest": "sha256:80630f83606d8db77d30b3851b16a9f78be2d0d4dda6f7b82a1fdca5ebe3acba"
    },
    "pgvectorPostgresql": {
      "reference": "pgvector/pgvector:pg18",
      "digest": "sha256:2ba9ca5f2e7daa0f0e7723cba1ee9167bab54efd3640516a44ac1a928dd67e7a"
    },
    "python": {
      "reference": "python:3.12.13-slim-bookworm",
      "digest": "sha256:4766d8b510c428e595d74b9cc5bbb2fae8e26316fffb4adc89908d79aacd58a2"
    },
    "minio": {
      "reference": "minio/minio:RELEASE.2025-09-07T16-13-09Z-cpuv1",
      "digest": "sha256:13582eff79c6605a2d315bdd0e70164142ea7e98fc8411e9e10d089502a6d883"
    },
    "minioMc": {
      "reference": "minio/mc:RELEASE.2025-08-13T08-35-41Z-cpuv1",
      "digest": "sha256:95b5f3f7969a5c5a9f3a700ba72d5c84172819e13385aaf916e237cf111ab868"
    },
    "valkey": {
      "reference": "valkey/valkey:8.1.1",
      "digest": "sha256:a19bebed6a91bd5e6e2106fef015f9602a3392deeb7c9ed47548378dcee3dfc2"
    },
    "mailpit": {
      "reference": "axllent/mailpit:v1.27.8",
      "digest": "sha256:6abc8e633df15eaf785cfcf38bae48e66f64beecdc03121e249d0f9ec15f0707"
    },
    "otelCollector": {
      "reference": "otel/opentelemetry-collector-contrib:0.146.0",
      "digest": "sha256:9742116fb9441d82900be0f35be168e14714fa64ff1f0f7aa182cfcf676832b1"
    },
    "gitleaks": {
      "reference": "ghcr.io/gitleaks/gitleaks:v8.30.1",
      "digest": "sha256:c00b6bd0aeb3071cbcb79009cb16a60dd9e0a7c60e2be9ab65d25e6bc8abbb7f"
    },
    "semgrep": {
      "reference": "semgrep/semgrep:1.176.0",
      "digest": "sha256:12672acdb0949e19f9f6a4c2b288edd0b404f268f0ca7738a2c06f372f50362e"
    },
    "trivy": {
      "reference": "aquasec/trivy:0.74.0",
      "digest": "sha256:62b1e65e8869bc4b4c6aa4fa2b21595256c7c2f6018a9d9ad61caf87187c1969"
    },
    "zap": {
      "reference": "ghcr.io/zaproxy/zaproxy:2.17.0",
      "digest": "sha256:781a2bdaea47324e7bab583e2263f21d257b0aee61ed51521a5be45f5f5081ef"
    },
    "k6": {
      "reference": "grafana/k6:2.2.0",
      "digest": "sha256:9bd01d6941fca969cb61bb57d2da5ee9b385fe2aa8881df3798c196564d6ace6"
    },
    "playwright": {
      "reference": "mcr.microsoft.com/playwright:v1.63.0-noble",
      "digest": "sha256:eff16c30e6f3f4af0a03fa4b706120d5e9b0891c344a27d64559aff5900a4a27"
    }
  },
  "enabledProfiles": [],
  "compatibilityEvidence": [
    {
      "gate": "source-template-validation",
      "status": "passed",
      "evidence": "Pinned Node 24.20.0 source and final 13-fixture validation is recorded in .thaarei/work/STARTER-016.md; earlier baseline evidence remains in STARTER-001 through STARTER-003, STARTER-005, STARTER-006, and STARTER-008."
    },
    {
      "gate": "web-developer-handoff",
      "status": "passed",
      "evidence": "The dedicated web, API, data, and identity fixture passed generated checks, typed proxy health, anonymous rejection, Better Auth session establishment, application identity persistence, two migration runs, and web/API container health under Node 24.20.0. Evidence is recorded in .thaarei/work/STARTER-003.md."
    },
    {
      "gate": "production-hardening-local-deep-validation",
      "status": "passed",
      "evidence": "STARTER-012 through STARTER-014 record pinned source security scans, coverage thresholds, production browser hydration and accessibility, OpenTelemetry collector receipt, k6 failure-rate checks, ZAP passive DAST, and PostgreSQL backup/restore proof."
    },
    {
      "gate": "immutable-image-attestation-and-inspection",
      "status": "blocked_external",
      "evidence": "The release-candidate workflow is executable, but exact GHCR digest scan, SBOM, attestation verification, and runtime inspection require protected registry credentials."
    },
    {
      "gate": "experimental-better-auth-expo-sdk-57-native-build",
      "status": "blocked_external",
      "evidence": "Requires iOS and Android development-build proof."
    },
    {
      "gate": "experimental-expo-metro-image-size-security-patch",
      "status": "waived",
      "evidence": "GHSA-5p2g-fcmc-qvqq is narrowly waived only for the generated experimental mobile fixture. Mobile is production-forbidden and generation is disabled after waiver expiry."
    },
    {
      "gate": "python-container-build",
      "status": "passed",
      "evidence": "The pinned Python 3.12.13 image built locally, started successfully, and returned HTTP 200 from /health/ready; the proof is recorded in .thaarei/work/STARTER-002.md."
    },
    {
      "gate": "dokploy-live-deployment-restore-rollback",
      "status": "blocked_external",
      "evidence": "Requires a disposable Dokploy environment."
    },
    {
      "gate": "beta-railway-live-service-mapping",
      "status": "blocked_external",
      "evidence": "Requires a disposable Railway project."
    }
  ],
  "packageVersions": {
    "@thaarei-technology/create-app": "1.0.0-dev.1",
    "@thaarei-technology/foundation": "1.0.0-dev.1",
    "@thaarei-technology/tooling": "1.0.0-dev.1"
  },
  "qualifications": [
    {
      "id": "web",
      "sourceMaturity": "stable",
      "productionPolicy": "starter_qualified",
      "qualification": "unqualified",
      "requiredGates": ["generation", "typecheck", "test"]
    },
    {
      "id": "api",
      "sourceMaturity": "stable",
      "productionPolicy": "starter_qualified",
      "qualification": "unqualified",
      "requiredGates": ["generation", "typecheck", "test"]
    },
    {
      "id": "data",
      "sourceMaturity": "stable",
      "productionPolicy": "starter_qualified",
      "qualification": "unqualified",
      "requiredGates": ["migration", "rls", "rollback", "restore"]
    },
    {
      "id": "identity",
      "sourceMaturity": "stable",
      "productionPolicy": "starter_qualified",
      "qualification": "unqualified",
      "requiredGates": ["verification", "recovery", "assurance", "session-revocation"]
    },
    {
      "id": "tenancy",
      "sourceMaturity": "stable",
      "productionPolicy": "starter_qualified",
      "qualification": "unqualified",
      "requiredGates": ["rls", "cross-tenant-isolation"]
    },
    {